{
  "$schema": "https://json-schema.org/draft/2020-12/schema",
  "$id": "https://tapture.app/schemas/shipped-template.json",
  "title": "Shipped template asset",
  "description": "JSON shape of one shipped template. required on each field is a suggested default only — any user who can edit the template may move a field between REQUIRED, RECOMMENDED and OPTIONAL (§13.2). The asset never locks requiredness.",
  "type": "object",
  "additionalProperties": true,
  "required": [
    "schema_version",
    "template_key",
    "name",
    "kind",
    "identity_fields",
    "inherits_groups",
    "fields",
    "child_rows"
  ],
  "properties": {
    "schema_version": {
      "type": "integer",
      "const": 1
    },
    "template_key": {
      "type": "string",
      "pattern": "^[a-z][a-z0-9]*(_[a-z0-9]+)*$"
    },
    "name": {
      "type": "string",
      "description": "Localisation key, not an English string (FE-L10N-01)."
    },
    "title": {
      "type": "string",
      "description": "Catalogue templates only: the display name, catalogue data rather than UI text (FE-L10N-07)."
    },
    "code": {
      "type": "string",
      "description": "Catalogue templates only: the catalogue code, for example UNI-001."
    },
    "kind": {
      "type": "string"
    },
    "pack": {
      "type": "string",
      "description": "Catalogue templates only: record type and reusable field definitions. Simple starters select their fields explicitly."
    },
    "privacy": {
      "enum": ["internal", "confidential", "restricted"],
      "description": "Catalogue templates only: suggested privacy."
    },
    "rollout": {
      "enum": ["p0", "p1", "p2"],
      "description": "Catalogue templates only: suggested tier (foundation, expansion, specialist)."
    },
    "identity_fields": {
      "type": "array",
      "items": {
        "type": "string"
      }
    },
    "inherits_groups": {
      "type": "array",
      "items": {
        "type": "string"
      }
    },
    "fields": {
      "type": "array",
      "items": {
        "$ref": "#/$defs/field"
      }
    },
    "derives_from": {
      "type": "string",
      "description": "Parent template_key when this asset extends another (§11.1)."
    },
    "child_rows": {
      "type": "array",
      "items": {
        "type": "object"
      }
    }
  },
  "$defs": {
    "field": {
      "type": "object",
      "additionalProperties": true,
      "required": ["field_key", "label", "type", "required"],
      "properties": {
        "field_key": {
          "type": "string",
          "description": "Stable snake_case key. Never renamed once shipped."
        },
        "label": {
          "type": "string",
          "description": "Localisation key, not an English string (FE-L10N-01)."
        },
        "type": {
          "description": "A FieldType from the registry of task 089. An unknown name is a violation (FE-CONS-07).",
          "enum": [
            "text",
            "long_text",
            "number",
            "decimal",
            "currency",
            "percentage",
            "date",
            "time",
            "date_time",
            "boolean",
            "choice",
            "multi_choice",
            "lookup",
            "barcode",
            "photo_reference",
            "document_reference",
            "gps_location",
            "signature",
            "computed"
          ]
        },
        "required": {
          "description": "Suggested default only. The user can change REQUIRED, RECOMMENDED or OPTIONAL on a copy of this template (§13.2). The schema carries no locked requiredness.",
          "enum": ["REQUIRED", "RECOMMENDED", "OPTIONAL"]
        },
        "required_when": {
          "type": "string"
        },
        "unit": {
          "type": "string"
        },
        "options": {
          "type": "array"
        },
        "group": {
          "type": "string"
        },
        "help": {
          "type": "string"
        },
        "input_mode": {
          "enum": ["any", "manual_only", "ai_allowed", "auto"],
          "description": "Who may fill the field (§12.2). Defaults to the group's mode, else any."
        },
        "auto_fill": {
          "enum": ["now", "today", "time", "sequence", "operator", "device", "gps", "context"],
          "description": "System fill source (§12.2)."
        },
        "refine": {
          "type": "boolean",
          "description": "Keep an AI-refined companion value beside the raw one (§32)."
        },
        "stickable": {
          "type": "boolean",
          "description": "May be pinned as context and carried to the next record (§20)."
        }
      }
    }
  }
}
